No.     Time           Source                Destination           Protocol Length Info
      1 0.000000       192.168.116.170       140.82.118.5          TCP      55     52186 → 443 [ACK] Seq=1 Ack=1 Win=258 Len=1 [TCP segment of a reassembled PDU]

Frame 1: 55 bytes on wire (440 bits), 55 bytes captured (440 bits) on interface 0
Ethernet II, Src: IntelCor_5c:42:bb (68:17:29:5c:42:bb), Dst: AsustekC_67:19:61 (00:18:f3:67:19:61)
Internet Protocol Version 4, Src: 192.168.116.170, Dst: 140.82.118.5
Transmission Control Protocol, Src Port: 52186, Dst Port: 443, Seq: 1, Ack: 1, Len: 1

No.     Time           Source                Destination           Protocol Length Info
      2 0.293530       AsustekC_67:19:61     Broadcast             ARP      60     Who has 192.168.152.81? Tell 192.168.1.1

Frame 2: 60 bytes on wire (480 bits), 60 bytes captured (480 bits) on interface 0
Ethernet II, Src: AsustekC_67:19:61 (00:18:f3:67:19:61), Dst: Broadcast (ff:ff:ff:ff:ff:ff)
Address Resolution Protocol (request)

No.     Time           Source                Destination           Protocol Length Info
      3 0.293889       192.168.101.190       239.255.255.250       SSDP     216    M-SEARCH * HTTP/1.1 

Frame 3: 216 bytes on wire (1728 bits), 216 bytes captured (1728 bits) on interface 0
Ethernet II, Src: Apple_02:98:4e (68:a8:6d:02:98:4e), Dst: IPv4mcast_7f:ff:fa (01:00:5e:7f:ff:fa)
Internet Protocol Version 4, Src: 192.168.101.190, Dst: 239.255.255.250
User Datagram Protocol, Src Port: 55568, Dst Port: 1900
Simple Service Discovery Protocol

No.     Time           Source                Destination           Protocol Length Info
      4 0.568123       140.82.118.5          192.168.116.170       TCP      66     443 → 52186 [ACK] Seq=1 Ack=2 Win=32 Len=0 SLE=1 SRE=2

Frame 4: 66 bytes on wire (528 bits), 66 bytes captured (528 bits) on interface 0
Ethernet II, Src: AsustekC_67:19:61 (00:18:f3:67:19:61), Dst: IntelCor_5c:42:bb (68:17:29:5c:42:bb)
Internet Protocol Version 4, Src: 140.82.118.5, Dst: 192.168.116.170
Transmission Control Protocol, Src Port: 443, Dst Port: 52186, Seq: 1, Ack: 2, Len: 0

No.     Time           Source                Destination           Protocol Length Info
      5 1.215065       AsustekC_67:19:61     Broadcast             ARP      60     Who has 192.168.152.81? Tell 192.168.1.1

Frame 5: 60 bytes on wire (480 bits), 60 bytes captured (480 bits) on interface 0
Ethernet II, Src: AsustekC_67:19:61 (00:18:f3:67:19:61), Dst: Broadcast (ff:ff:ff:ff:ff:ff)
Address Resolution Protocol (request)

No.     Time           Source                Destination           Protocol Length Info
      6 1.317591       192.168.101.190       239.255.255.250       SSDP     216    M-SEARCH * HTTP/1.1 

Frame 6: 216 bytes on wire (1728 bits), 216 bytes captured (1728 bits) on interface 0
Ethernet II, Src: Apple_02:98:4e (68:a8:6d:02:98:4e), Dst: IPv4mcast_7f:ff:fa (01:00:5e:7f:ff:fa)
Internet Protocol Version 4, Src: 192.168.101.190, Dst: 239.255.255.250
User Datagram Protocol, Src Port: 55568, Dst Port: 1900
Simple Service Discovery Protocol

No.     Time           Source                Destination           Protocol Length Info
      7 1.318145       192.168.101.190       239.255.255.250       SSDP     216    M-SEARCH * HTTP/1.1 

Frame 7: 216 bytes on wire (1728 bits), 216 bytes captured (1728 bits) on interface 0
Ethernet II, Src: Apple_02:98:4e (68:a8:6d:02:98:4e), Dst: IPv4mcast_7f:ff:fa (01:00:5e:7f:ff:fa)
Internet Protocol Version 4, Src: 192.168.101.190, Dst: 239.255.255.250
User Datagram Protocol, Src Port: 36984, Dst Port: 1900
Simple Service Discovery Protocol

No.     Time           Source                Destination           Protocol Length Info
      8 3.263197       AsustekC_67:19:61     Broadcast             ARP      60     Who has 192.168.159.76? Tell 192.168.1.1

Frame 8: 60 bytes on wire (480 bits), 60 bytes captured (480 bits) on interface 0
Ethernet II, Src: AsustekC_67:19:61 (00:18:f3:67:19:61), Dst: Broadcast (ff:ff:ff:ff:ff:ff)
Address Resolution Protocol (request)

No.     Time           Source                Destination           Protocol Length Info
      9 3.263419       AsustekC_67:19:61     Broadcast             ARP      60     Who has 192.168.152.81? Tell 192.168.1.1

Frame 9: 60 bytes on wire (480 bits), 60 bytes captured (480 bits) on interface 0
Ethernet II, Src: AsustekC_67:19:61 (00:18:f3:67:19:61), Dst: Broadcast (ff:ff:ff:ff:ff:ff)
Address Resolution Protocol (request)

No.     Time           Source                Destination           Protocol Length Info
     10 3.413697       192.168.116.170       151.101.112.133       TCP      55     52184 → 443 [ACK] Seq=1 Ack=1 Win=509 Len=1 [TCP segment of a reassembled PDU]

Frame 10: 55 bytes on wire (440 bits), 55 bytes captured (440 bits) on interface 0
Ethernet II, Src: IntelCor_5c:42:bb (68:17:29:5c:42:bb), Dst: AsustekC_67:19:61 (00:18:f3:67:19:61)
Internet Protocol Version 4, Src: 192.168.116.170, Dst: 151.101.112.133
Transmission Control Protocol, Src Port: 52184, Dst Port: 443, Seq: 1, Ack: 1, Len: 1

No.     Time           Source                Destination           Protocol Length Info
     11 3.782842       151.101.112.133       192.168.116.170       TCP      66     443 → 52184 [ACK] Seq=1 Ack=2 Win=62 Len=0 SLE=1 SRE=2

Frame 11: 66 bytes on wire (528 bits), 66 bytes captured (528 bits) on interface 0
Ethernet II, Src: AsustekC_67:19:61 (00:18:f3:67:19:61), Dst: IntelCor_5c:42:bb (68:17:29:5c:42:bb)
Internet Protocol Version 4, Src: 151.101.112.133, Dst: 192.168.116.170
Transmission Control Protocol, Src Port: 443, Dst Port: 52184, Seq: 1, Ack: 2, Len: 0

No.     Time           Source                Destination           Protocol Length Info
     12 4.287188       AsustekC_67:19:61     Broadcast             ARP      60     Who has 192.168.159.76? Tell 192.168.1.1

Frame 12: 60 bytes on wire (480 bits), 60 bytes captured (480 bits) on interface 0
Ethernet II, Src: AsustekC_67:19:61 (00:18:f3:67:19:61), Dst: Broadcast (ff:ff:ff:ff:ff:ff)
Address Resolution Protocol (request)

No.     Time           Source                Destination           Protocol Length Info
     13 4.287535       AsustekC_67:19:61     Broadcast             ARP      60     Who has 192.168.152.81? Tell 192.168.1.1

Frame 13: 60 bytes on wire (480 bits), 60 bytes captured (480 bits) on interface 0
Ethernet II, Src: AsustekC_67:19:61 (00:18:f3:67:19:61), Dst: Broadcast (ff:ff:ff:ff:ff:ff)
Address Resolution Protocol (request)

No.     Time           Source                Destination           Protocol Length Info
     14 5.208803       AsustekC_67:19:61     Broadcast             ARP      60     Who has 192.168.159.76? Tell 192.168.1.1

Frame 14: 60 bytes on wire (480 bits), 60 bytes captured (480 bits) on interface 0
Ethernet II, Src: AsustekC_67:19:61 (00:18:f3:67:19:61), Dst: Broadcast (ff:ff:ff:ff:ff:ff)
Address Resolution Protocol (request)

No.     Time           Source                Destination           Protocol Length Info
     15 5.311164       AsustekC_67:19:61     Broadcast             ARP      60     Who has 192.168.152.81? Tell 192.168.1.1

Frame 15: 60 bytes on wire (480 bits), 60 bytes captured (480 bits) on interface 0
Ethernet II, Src: AsustekC_67:19:61 (00:18:f3:67:19:61), Dst: Broadcast (ff:ff:ff:ff:ff:ff)
Address Resolution Protocol (request)

No.     Time           Source                Destination           Protocol Length Info
     16 5.331140       192.168.116.170       128.119.245.12        TCP      66     52187 → 80 [SYN] Seq=0 Win=64240 Len=0 MSS=1460 WS=256 SACK_PERM=1

Frame 16: 66 bytes on wire (528 bits), 66 bytes captured (528 bits) on interface 0
Ethernet II, Src: IntelCor_5c:42:bb (68:17:29:5c:42:bb), Dst: AsustekC_67:19:61 (00:18:f3:67:19:61)
Internet Protocol Version 4, Src: 192.168.116.170, Dst: 128.119.245.12
Transmission Control Protocol, Src Port: 52187, Dst Port: 80, Seq: 0, Len: 0

No.     Time           Source                Destination           Protocol Length Info
     17 5.334129       192.168.116.170       128.119.245.12        TCP      66     52188 → 80 [SYN] Seq=0 Win=64240 Len=0 MSS=1460 WS=256 SACK_PERM=1

Frame 17: 66 bytes on wire (528 bits), 66 bytes captured (528 bits) on interface 0
Ethernet II, Src: IntelCor_5c:42:bb (68:17:29:5c:42:bb), Dst: AsustekC_67:19:61 (00:18:f3:67:19:61)
Internet Protocol Version 4, Src: 192.168.116.170, Dst: 128.119.245.12
Transmission Control Protocol, Src Port: 52188, Dst Port: 80, Seq: 0, Len: 0

No.     Time           Source                Destination           Protocol Length Info
     18 5.361193       192.168.116.170       128.119.245.12        TCP      66     52189 → 80 [SYN] Seq=0 Win=64240 Len=0 MSS=1460 WS=256 SACK_PERM=1

Frame 18: 66 bytes on wire (528 bits), 66 bytes captured (528 bits) on interface 0
Ethernet II, Src: IntelCor_5c:42:bb (68:17:29:5c:42:bb), Dst: AsustekC_67:19:61 (00:18:f3:67:19:61)
Internet Protocol Version 4, Src: 192.168.116.170, Dst: 128.119.245.12
Transmission Control Protocol, Src Port: 52189, Dst Port: 80, Seq: 0, Len: 0

No.     Time           Source                Destination           Protocol Length Info
     19 5.361200       192.168.116.170       10.35.8.1             DNS      77     Standard query 0x8c8c AAAA gaia.cs.umass.edu

Frame 19: 77 bytes on wire (616 bits), 77 bytes captured (616 bits) on interface 0
Ethernet II, Src: IntelCor_5c:42:bb (68:17:29:5c:42:bb), Dst: AsustekC_67:19:61 (00:18:f3:67:19:61)
Internet Protocol Version 4, Src: 192.168.116.170, Dst: 10.35.8.1
User Datagram Protocol, Src Port: 55793, Dst Port: 53
Domain Name System (query)

No.     Time           Source                Destination           Protocol Length Info
     20 5.455454       192.168.116.170       10.35.7.1             DNS      77     Standard query 0x8c8c AAAA gaia.cs.umass.edu

Frame 20: 77 bytes on wire (616 bits), 77 bytes captured (616 bits) on interface 0
Ethernet II, Src: IntelCor_5c:42:bb (68:17:29:5c:42:bb), Dst: AsustekC_67:19:61 (00:18:f3:67:19:61)
Internet Protocol Version 4, Src: 192.168.116.170, Dst: 10.35.7.1
User Datagram Protocol, Src Port: 55793, Dst Port: 53
Domain Name System (query)

No.     Time           Source                Destination           Protocol Length Info
     21 5.617659       192.168.116.170       128.119.245.12        TCP      66     52190 → 80 [SYN] Seq=0 Win=64240 Len=0 MSS=1460 WS=256 SACK_PERM=1

Frame 21: 66 bytes on wire (528 bits), 66 bytes captured (528 bits) on interface 0
Ethernet II, Src: IntelCor_5c:42:bb (68:17:29:5c:42:bb), Dst: AsustekC_67:19:61 (00:18:f3:67:19:61)
Internet Protocol Version 4, Src: 192.168.116.170, Dst: 128.119.245.12
Transmission Control Protocol, Src Port: 52190, Dst Port: 80, Seq: 0, Len: 0

No.     Time           Source                Destination           Protocol Length Info
     22 5.618482       192.168.116.158       239.255.255.250       SSDP     216    M-SEARCH * HTTP/1.1 

Frame 22: 216 bytes on wire (1728 bits), 216 bytes captured (1728 bits) on interface 0
Ethernet II, Src: Apple_44:3f:73 (f0:18:98:44:3f:73), Dst: IPv4mcast_7f:ff:fa (01:00:5e:7f:ff:fa)
Internet Protocol Version 4, Src: 192.168.116.158, Dst: 239.255.255.250
User Datagram Protocol, Src Port: 56272, Dst Port: 1900
Simple Service Discovery Protocol

No.     Time           Source                Destination           Protocol Length Info
     23 5.800608       10.35.8.1             192.168.116.170       DNS      130    Standard query response 0x8c8c AAAA gaia.cs.umass.edu SOA unix1.cs.umass.edu

Frame 23: 130 bytes on wire (1040 bits), 130 bytes captured (1040 bits) on interface 0
Ethernet II, Src: AsustekC_67:19:61 (00:18:f3:67:19:61), Dst: IntelCor_5c:42:bb (68:17:29:5c:42:bb)
Internet Protocol Version 4, Src: 10.35.8.1, Dst: 192.168.116.170
User Datagram Protocol, Src Port: 53, Dst Port: 55793
Domain Name System (response)

No.     Time           Source                Destination           Protocol Length Info
     24 5.893243       128.119.245.12        192.168.116.170       TCP      66     80 → 52187 [SYN, ACK] Seq=0 Ack=1 Win=29200 Len=0 MSS=1460 SACK_PERM=1 WS=128

Frame 24: 66 bytes on wire (528 bits), 66 bytes captured (528 bits) on interface 0
Ethernet II, Src: AsustekC_67:19:61 (00:18:f3:67:19:61), Dst: IntelCor_5c:42:bb (68:17:29:5c:42:bb)
Internet Protocol Version 4, Src: 128.119.245.12, Dst: 192.168.116.170
Transmission Control Protocol, Src Port: 80, Dst Port: 52187, Seq: 0, Ack: 1, Len: 0

No.     Time           Source                Destination           Protocol Length Info
     25 5.893418       192.168.116.170       128.119.245.12        TCP      54     52187 → 80 [ACK] Seq=1 Ack=1 Win=65536 Len=0

Frame 25: 54 bytes on wire (432 bits), 54 bytes captured (432 bits) on interface 0
Ethernet II, Src: IntelCor_5c:42:bb (68:17:29:5c:42:bb), Dst: AsustekC_67:19:61 (00:18:f3:67:19:61)
Internet Protocol Version 4, Src: 192.168.116.170, Dst: 128.119.245.12
Transmission Control Protocol, Src Port: 52187, Dst Port: 80, Seq: 1, Ack: 1, Len: 0

No.     Time           Source                Destination           Protocol Length Info
     26 5.894171       192.168.116.170       128.119.245.12        HTTP     554    GET /wireshark-labs/HTTP-wireshark-file4.html HTTP/1.1 

Frame 26: 554 bytes on wire (4432 bits), 554 bytes captured (4432 bits) on interface 0
Ethernet II, Src: IntelCor_5c:42:bb (68:17:29:5c:42:bb), Dst: AsustekC_67:19:61 (00:18:f3:67:19:61)
Internet Protocol Version 4, Src: 192.168.116.170, Dst: 128.119.245.12
Transmission Control Protocol, Src Port: 52187, Dst Port: 80, Seq: 1, Ack: 1, Len: 500
Hypertext Transfer Protocol

No.     Time           Source                Destination           Protocol Length Info
     27 5.897277       10.35.7.1             192.168.116.170       DNS      130    Standard query response 0x8c8c AAAA gaia.cs.umass.edu SOA unix1.cs.umass.edu

Frame 27: 130 bytes on wire (1040 bits), 130 bytes captured (1040 bits) on interface 0
Ethernet II, Src: AsustekC_67:19:61 (00:18:f3:67:19:61), Dst: IntelCor_5c:42:bb (68:17:29:5c:42:bb)
Internet Protocol Version 4, Src: 10.35.7.1, Dst: 192.168.116.170
User Datagram Protocol, Src Port: 53, Dst Port: 55793
Domain Name System (response)

No.     Time           Source                Destination           Protocol Length Info
     28 5.897504       128.119.245.12        192.168.116.170       TCP      66     80 → 52188 [SYN, ACK] Seq=0 Ack=1 Win=29200 Len=0 MSS=1460 SACK_PERM=1 WS=128

Frame 28: 66 bytes on wire (528 bits), 66 bytes captured (528 bits) on interface 0
Ethernet II, Src: AsustekC_67:19:61 (00:18:f3:67:19:61), Dst: IntelCor_5c:42:bb (68:17:29:5c:42:bb)
Internet Protocol Version 4, Src: 128.119.245.12, Dst: 192.168.116.170
Transmission Control Protocol, Src Port: 80, Dst Port: 52188, Seq: 0, Ack: 1, Len: 0

No.     Time           Source                Destination           Protocol Length Info
     29 5.897671       192.168.116.170       128.119.245.12        TCP      54     52188 → 80 [ACK] Seq=1 Ack=1 Win=65536 Len=0

Frame 29: 54 bytes on wire (432 bits), 54 bytes captured (432 bits) on interface 0
Ethernet II, Src: IntelCor_5c:42:bb (68:17:29:5c:42:bb), Dst: AsustekC_67:19:61 (00:18:f3:67:19:61)
Internet Protocol Version 4, Src: 192.168.116.170, Dst: 128.119.245.12
Transmission Control Protocol, Src Port: 52188, Dst Port: 80, Seq: 1, Ack: 1, Len: 0

No.     Time           Source                Destination           Protocol Length Info
     30 5.926158       128.119.245.12        192.168.116.170       TCP      66     80 → 52189 [SYN, ACK] Seq=0 Ack=1 Win=29200 Len=0 MSS=1460 SACK_PERM=1 WS=128

Frame 30: 66 bytes on wire (528 bits), 66 bytes captured (528 bits) on interface 0
Ethernet II, Src: AsustekC_67:19:61 (00:18:f3:67:19:61), Dst: IntelCor_5c:42:bb (68:17:29:5c:42:bb)
Internet Protocol Version 4, Src: 128.119.245.12, Dst: 192.168.116.170
Transmission Control Protocol, Src Port: 80, Dst Port: 52189, Seq: 0, Ack: 1, Len: 0

No.     Time           Source                Destination           Protocol Length Info
     31 5.926329       192.168.116.170       128.119.245.12        TCP      54     52189 → 80 [ACK] Seq=1 Ack=1 Win=65536 Len=0

Frame 31: 54 bytes on wire (432 bits), 54 bytes captured (432 bits) on interface 0
Ethernet II, Src: IntelCor_5c:42:bb (68:17:29:5c:42:bb), Dst: AsustekC_67:19:61 (00:18:f3:67:19:61)
Internet Protocol Version 4, Src: 192.168.116.170, Dst: 128.119.245.12
Transmission Control Protocol, Src Port: 52189, Dst Port: 80, Seq: 1, Ack: 1, Len: 0

No.     Time           Source                Destination           Protocol Length Info
     32 6.193378       128.119.245.12        192.168.116.170       TCP      66     80 → 52190 [SYN, ACK] Seq=0 Ack=1 Win=29200 Len=0 MSS=1460 SACK_PERM=1 WS=128

Frame 32: 66 bytes on wire (528 bits), 66 bytes captured (528 bits) on interface 0
Ethernet II, Src: AsustekC_67:19:61 (00:18:f3:67:19:61), Dst: IntelCor_5c:42:bb (68:17:29:5c:42:bb)
Internet Protocol Version 4, Src: 128.119.245.12, Dst: 192.168.116.170
Transmission Control Protocol, Src Port: 80, Dst Port: 52190, Seq: 0, Ack: 1, Len: 0

No.     Time           Source                Destination           Protocol Length Info
     33 6.193553       192.168.116.170       128.119.245.12        TCP      54     52190 → 80 [ACK] Seq=1 Ack=1 Win=65536 Len=0

Frame 33: 54 bytes on wire (432 bits), 54 bytes captured (432 bits) on interface 0
Ethernet II, Src: IntelCor_5c:42:bb (68:17:29:5c:42:bb), Dst: AsustekC_67:19:61 (00:18:f3:67:19:61)
Internet Protocol Version 4, Src: 192.168.116.170, Dst: 128.119.245.12
Transmission Control Protocol, Src Port: 52190, Dst Port: 80, Seq: 1, Ack: 1, Len: 0

No.     Time           Source                Destination           Protocol Length Info
     34 6.335166       AsustekC_67:19:61     Broadcast             ARP      60     Who has 192.168.152.81? Tell 192.168.1.1

Frame 34: 60 bytes on wire (480 bits), 60 bytes captured (480 bits) on interface 0
Ethernet II, Src: AsustekC_67:19:61 (00:18:f3:67:19:61), Dst: Broadcast (ff:ff:ff:ff:ff:ff)
Address Resolution Protocol (request)

No.     Time           Source                Destination           Protocol Length Info
     35 6.445813       128.119.245.12        192.168.116.170       TCP      60     80 → 52187 [ACK] Seq=1 Ack=501 Win=30336 Len=0

Frame 35: 60 bytes on wire (480 bits), 60 bytes captured (480 bits) on interface 0
Ethernet II, Src: AsustekC_67:19:61 (00:18:f3:67:19:61), Dst: IntelCor_5c:42:bb (68:17:29:5c:42:bb)
Internet Protocol Version 4, Src: 128.119.245.12, Dst: 192.168.116.170
Transmission Control Protocol, Src Port: 80, Dst Port: 52187, Seq: 1, Ack: 501, Len: 0

No.     Time           Source                Destination           Protocol Length Info
     36 6.448858       128.119.245.12        192.168.116.170       HTTP     294    HTTP/1.1 304 Not Modified 

Frame 36: 294 bytes on wire (2352 bits), 294 bytes captured (2352 bits) on interface 0
Ethernet II, Src: AsustekC_67:19:61 (00:18:f3:67:19:61), Dst: IntelCor_5c:42:bb (68:17:29:5c:42:bb)
Internet Protocol Version 4, Src: 128.119.245.12, Dst: 192.168.116.170
Transmission Control Protocol, Src Port: 80, Dst Port: 52187, Seq: 1, Ack: 501, Len: 240
Hypertext Transfer Protocol

No.     Time           Source                Destination           Protocol Length Info
     37 6.495173       192.168.116.170       128.119.245.12        TCP      54     52187 → 80 [ACK] Seq=501 Ack=241 Win=65280 Len=0

Frame 37: 54 bytes on wire (432 bits), 54 bytes captured (432 bits) on interface 0
Ethernet II, Src: IntelCor_5c:42:bb (68:17:29:5c:42:bb), Dst: AsustekC_67:19:61 (00:18:f3:67:19:61)
Internet Protocol Version 4, Src: 192.168.116.170, Dst: 128.119.245.12
Transmission Control Protocol, Src Port: 52187, Dst Port: 80, Seq: 501, Ack: 241, Len: 0

No.     Time           Source                Destination           Protocol Length Info
     38 6.525070       192.168.116.170       128.119.245.12        HTTP     436    GET /pearson.png HTTP/1.1 

Frame 38: 436 bytes on wire (3488 bits), 436 bytes captured (3488 bits) on interface 0
Ethernet II, Src: IntelCor_5c:42:bb (68:17:29:5c:42:bb), Dst: AsustekC_67:19:61 (00:18:f3:67:19:61)
Internet Protocol Version 4, Src: 192.168.116.170, Dst: 128.119.245.12
Transmission Control Protocol, Src Port: 52189, Dst Port: 80, Seq: 1, Ack: 1, Len: 382
Hypertext Transfer Protocol

No.     Time           Source                Destination           Protocol Length Info
     39 6.529770       192.168.116.170       128.119.245.12        HTTP     450    GET /~kurose/cover_5th_ed.jpg HTTP/1.1 

Frame 39: 450 bytes on wire (3600 bits), 450 bytes captured (3600 bits) on interface 0
Ethernet II, Src: IntelCor_5c:42:bb (68:17:29:5c:42:bb), Dst: AsustekC_67:19:61 (00:18:f3:67:19:61)
Internet Protocol Version 4, Src: 192.168.116.170, Dst: 128.119.245.12
Transmission Control Protocol, Src Port: 52188, Dst Port: 80, Seq: 1, Ack: 1, Len: 396
Hypertext Transfer Protocol

No.     Time           Source                Destination           Protocol Length Info
     40 6.642510       192.168.116.158       239.255.255.250       SSDP     216    M-SEARCH * HTTP/1.1 

Frame 40: 216 bytes on wire (1728 bits), 216 bytes captured (1728 bits) on interface 0
Ethernet II, Src: Apple_44:3f:73 (f0:18:98:44:3f:73), Dst: IPv4mcast_7f:ff:fa (01:00:5e:7f:ff:fa)
Internet Protocol Version 4, Src: 192.168.116.158, Dst: 239.255.255.250
User Datagram Protocol, Src Port: 56272, Dst Port: 1900
Simple Service Discovery Protocol

No.     Time           Source                Destination           Protocol Length Info
     41 6.642800       Azurewav_72:c6:a7     Broadcast             ARP      42     Who has 192.168.1.1? Tell 192.168.116.169

Frame 41: 42 bytes on wire (336 bits), 42 bytes captured (336 bits) on interface 0
Ethernet II, Src: Azurewav_72:c6:a7 (74:f0:6d:72:c6:a7), Dst: Broadcast (ff:ff:ff:ff:ff:ff)
Address Resolution Protocol (request)

No.     Time           Source                Destination           Protocol Length Info
     42 7.016578       128.119.245.12        192.168.116.170       TCP      60     80 → 52189 [ACK] Seq=1 Ack=383 Win=30336 Len=0

Frame 42: 60 bytes on wire (480 bits), 60 bytes captured (480 bits) on interface 0
Ethernet II, Src: AsustekC_67:19:61 (00:18:f3:67:19:61), Dst: IntelCor_5c:42:bb (68:17:29:5c:42:bb)
Internet Protocol Version 4, Src: 128.119.245.12, Dst: 192.168.116.170
Transmission Control Protocol, Src Port: 80, Dst Port: 52189, Seq: 1, Ack: 383, Len: 0

No.     Time           Source                Destination           Protocol Length Info
     43 7.020065       128.119.245.12        192.168.116.170       TCP      1514   80 → 52189 [ACK] Seq=1 Ack=383 Win=30336 Len=1460 [TCP segment of a reassembled PDU]

Frame 43: 1514 bytes on wire (12112 bits), 1514 bytes captured (12112 bits) on interface 0
Ethernet II, Src: AsustekC_67:19:61 (00:18:f3:67:19:61), Dst: IntelCor_5c:42:bb (68:17:29:5c:42:bb)
Internet Protocol Version 4, Src: 128.119.245.12, Dst: 192.168.116.170
Transmission Control Protocol, Src Port: 80, Dst Port: 52189, Seq: 1, Ack: 383, Len: 1460

No.     Time           Source                Destination           Protocol Length Info
     44 7.021906       128.119.245.12        192.168.116.170       TCP      1514   80 → 52189 [ACK] Seq=1461 Ack=383 Win=30336 Len=1460 [TCP segment of a reassembled PDU]

Frame 44: 1514 bytes on wire (12112 bits), 1514 bytes captured (12112 bits) on interface 0
Ethernet II, Src: AsustekC_67:19:61 (00:18:f3:67:19:61), Dst: IntelCor_5c:42:bb (68:17:29:5c:42:bb)
Internet Protocol Version 4, Src: 128.119.245.12, Dst: 192.168.116.170
Transmission Control Protocol, Src Port: 80, Dst Port: 52189, Seq: 1461, Ack: 383, Len: 1460

No.     Time           Source                Destination           Protocol Length Info
     45 7.022026       192.168.116.170       128.119.245.12        TCP      54     52189 → 80 [ACK] Seq=383 Ack=2921 Win=65536 Len=0

Frame 45: 54 bytes on wire (432 bits), 54 bytes captured (432 bits) on interface 0
Ethernet II, Src: IntelCor_5c:42:bb (68:17:29:5c:42:bb), Dst: AsustekC_67:19:61 (00:18:f3:67:19:61)
Internet Protocol Version 4, Src: 192.168.116.170, Dst: 128.119.245.12
Transmission Control Protocol, Src Port: 52189, Dst Port: 80, Seq: 383, Ack: 2921, Len: 0

No.     Time           Source                Destination           Protocol Length Info
     46 7.023649       128.119.245.12        192.168.116.170       HTTP     746    HTTP/1.1 200 OK  (PNG)

Frame 46: 746 bytes on wire (5968 bits), 746 bytes captured (5968 bits) on interface 0
Ethernet II, Src: AsustekC_67:19:61 (00:18:f3:67:19:61), Dst: IntelCor_5c:42:bb (68:17:29:5c:42:bb)
Internet Protocol Version 4, Src: 128.119.245.12, Dst: 192.168.116.170
Transmission Control Protocol, Src Port: 80, Dst Port: 52189, Seq: 2921, Ack: 383, Len: 692
[3 Reassembled TCP Segments (3612 bytes): #43(1460), #44(1460), #46(692)]
Hypertext Transfer Protocol
Portable Network Graphics

No.     Time           Source                Destination           Protocol Length Info
     47 7.026596       128.119.245.12        192.168.116.170       TCP      60     80 → 52188 [ACK] Seq=1 Ack=397 Win=30336 Len=0

Frame 47: 60 bytes on wire (480 bits), 60 bytes captured (480 bits) on interface 0
Ethernet II, Src: AsustekC_67:19:61 (00:18:f3:67:19:61), Dst: IntelCor_5c:42:bb (68:17:29:5c:42:bb)
Internet Protocol Version 4, Src: 128.119.245.12, Dst: 192.168.116.170
Transmission Control Protocol, Src Port: 80, Dst Port: 52188, Seq: 1, Ack: 397, Len: 0

No.     Time           Source                Destination           Protocol Length Info
     48 7.030061       128.119.245.12        192.168.116.170       TCP      1514   80 → 52188 [ACK] Seq=1 Ack=397 Win=30336 Len=1460 [TCP segment of a reassembled PDU]

Frame 48: 1514 bytes on wire (12112 bits), 1514 bytes captured (12112 bits) on interface 0
Ethernet II, Src: AsustekC_67:19:61 (00:18:f3:67:19:61), Dst: IntelCor_5c:42:bb (68:17:29:5c:42:bb)
Internet Protocol Version 4, Src: 128.119.245.12, Dst: 192.168.116.170
Transmission Control Protocol, Src Port: 80, Dst Port: 52188, Seq: 1, Ack: 397, Len: 1460

No.     Time           Source                Destination           Protocol Length Info
     49 7.031182       128.119.245.12        192.168.116.170       TCP      1514   80 → 52188 [ACK] Seq=1461 Ack=397 Win=30336 Len=1460 [TCP segment of a reassembled PDU]

Frame 49: 1514 bytes on wire (12112 bits), 1514 bytes captured (12112 bits) on interface 0
Ethernet II, Src: AsustekC_67:19:61 (00:18:f3:67:19:61), Dst: IntelCor_5c:42:bb (68:17:29:5c:42:bb)
Internet Protocol Version 4, Src: 128.119.245.12, Dst: 192.168.116.170
Transmission Control Protocol, Src Port: 80, Dst Port: 52188, Seq: 1461, Ack: 397, Len: 1460

No.     Time           Source                Destination           Protocol Length Info
     50 7.031303       192.168.116.170       128.119.245.12        TCP      54     52188 → 80 [ACK] Seq=397 Ack=2921 Win=65536 Len=0

Frame 50: 54 bytes on wire (432 bits), 54 bytes captured (432 bits) on interface 0
Ethernet II, Src: IntelCor_5c:42:bb (68:17:29:5c:42:bb), Dst: AsustekC_67:19:61 (00:18:f3:67:19:61)
Internet Protocol Version 4, Src: 192.168.116.170, Dst: 128.119.245.12
Transmission Control Protocol, Src Port: 52188, Dst Port: 80, Seq: 397, Ack: 2921, Len: 0

No.     Time           Source                Destination           Protocol Length Info
     51 7.032854       128.119.245.12        192.168.116.170       TCP      1514   80 → 52188 [ACK] Seq=2921 Ack=397 Win=30336 Len=1460 [TCP segment of a reassembled PDU]

Frame 51: 1514 bytes on wire (12112 bits), 1514 bytes captured (12112 bits) on interface 0
Ethernet II, Src: AsustekC_67:19:61 (00:18:f3:67:19:61), Dst: IntelCor_5c:42:bb (68:17:29:5c:42:bb)
Internet Protocol Version 4, Src: 128.119.245.12, Dst: 192.168.116.170
Transmission Control Protocol, Src Port: 80, Dst Port: 52188, Seq: 2921, Ack: 397, Len: 1460

No.     Time           Source                Destination           Protocol Length Info
     52 7.034233       128.119.245.12        192.168.116.170       TCP      1514   80 → 52188 [ACK] Seq=4381 Ack=397 Win=30336 Len=1460 [TCP segment of a reassembled PDU]

Frame 52: 1514 bytes on wire (12112 bits), 1514 bytes captured (12112 bits) on interface 0
Ethernet II, Src: AsustekC_67:19:61 (00:18:f3:67:19:61), Dst: IntelCor_5c:42:bb (68:17:29:5c:42:bb)
Internet Protocol Version 4, Src: 128.119.245.12, Dst: 192.168.116.170
Transmission Control Protocol, Src Port: 80, Dst Port: 52188, Seq: 4381, Ack: 397, Len: 1460

No.     Time           Source                Destination           Protocol Length Info
     53 7.034364       192.168.116.170       128.119.245.12        TCP      54     52188 → 80 [ACK] Seq=397 Ack=5841 Win=65536 Len=0

Frame 53: 54 bytes on wire (432 bits), 54 bytes captured (432 bits) on interface 0
Ethernet II, Src: IntelCor_5c:42:bb (68:17:29:5c:42:bb), Dst: AsustekC_67:19:61 (00:18:f3:67:19:61)
Internet Protocol Version 4, Src: 192.168.116.170, Dst: 128.119.245.12
Transmission Control Protocol, Src Port: 52188, Dst Port: 80, Seq: 397, Ack: 5841, Len: 0

No.     Time           Source                Destination           Protocol Length Info
     54 7.035705       128.119.245.12        192.168.116.170       TCP      1514   80 → 52188 [ACK] Seq=5841 Ack=397 Win=30336 Len=1460 [TCP segment of a reassembled PDU]

Frame 54: 1514 bytes on wire (12112 bits), 1514 bytes captured (12112 bits) on interface 0
Ethernet II, Src: AsustekC_67:19:61 (00:18:f3:67:19:61), Dst: IntelCor_5c:42:bb (68:17:29:5c:42:bb)
Internet Protocol Version 4, Src: 128.119.245.12, Dst: 192.168.116.170
Transmission Control Protocol, Src Port: 80, Dst Port: 52188, Seq: 5841, Ack: 397, Len: 1460

No.     Time           Source                Destination           Protocol Length Info
     55 7.037212       128.119.245.12        192.168.116.170       TCP      1514   80 → 52188 [ACK] Seq=7301 Ack=397 Win=30336 Len=1460 [TCP segment of a reassembled PDU]

Frame 55: 1514 bytes on wire (12112 bits), 1514 bytes captured (12112 bits) on interface 0
Ethernet II, Src: AsustekC_67:19:61 (00:18:f3:67:19:61), Dst: IntelCor_5c:42:bb (68:17:29:5c:42:bb)
Internet Protocol Version 4, Src: 128.119.245.12, Dst: 192.168.116.170
Transmission Control Protocol, Src Port: 80, Dst Port: 52188, Seq: 7301, Ack: 397, Len: 1460

No.     Time           Source                Destination           Protocol Length Info
     56 7.037313       192.168.116.170       128.119.245.12        TCP      54     52188 → 80 [ACK] Seq=397 Ack=8761 Win=65536 Len=0

Frame 56: 54 bytes on wire (432 bits), 54 bytes captured (432 bits) on interface 0
Ethernet II, Src: IntelCor_5c:42:bb (68:17:29:5c:42:bb), Dst: AsustekC_67:19:61 (00:18:f3:67:19:61)
Internet Protocol Version 4, Src: 192.168.116.170, Dst: 128.119.245.12
Transmission Control Protocol, Src Port: 52188, Dst Port: 80, Seq: 397, Ack: 8761, Len: 0

No.     Time           Source                Destination           Protocol Length Info
     57 7.038734       128.119.245.12        192.168.116.170       TCP      1514   80 → 52188 [ACK] Seq=8761 Ack=397 Win=30336 Len=1460 [TCP segment of a reassembled PDU]

Frame 57: 1514 bytes on wire (12112 bits), 1514 bytes captured (12112 bits) on interface 0
Ethernet II, Src: AsustekC_67:19:61 (00:18:f3:67:19:61), Dst: IntelCor_5c:42:bb (68:17:29:5c:42:bb)
Internet Protocol Version 4, Src: 128.119.245.12, Dst: 192.168.116.170
Transmission Control Protocol, Src Port: 80, Dst Port: 52188, Seq: 8761, Ack: 397, Len: 1460

No.     Time           Source                Destination           Protocol Length Info
     58 7.047000       128.119.245.12        192.168.116.170       TCP      1514   80 → 52188 [ACK] Seq=10221 Ack=397 Win=30336 Len=1460 [TCP segment of a reassembled PDU]

Frame 58: 1514 bytes on wire (12112 bits), 1514 bytes captured (12112 bits) on interface 0
Ethernet II, Src: AsustekC_67:19:61 (00:18:f3:67:19:61), Dst: IntelCor_5c:42:bb (68:17:29:5c:42:bb)
Internet Protocol Version 4, Src: 128.119.245.12, Dst: 192.168.116.170
Transmission Control Protocol, Src Port: 80, Dst Port: 52188, Seq: 10221, Ack: 397, Len: 1460

No.     Time           Source                Destination           Protocol Length Info
     59 7.047066       192.168.116.170       128.119.245.12        TCP      54     52188 → 80 [ACK] Seq=397 Ack=11681 Win=65536 Len=0

Frame 59: 54 bytes on wire (432 bits), 54 bytes captured (432 bits) on interface 0
Ethernet II, Src: IntelCor_5c:42:bb (68:17:29:5c:42:bb), Dst: AsustekC_67:19:61 (00:18:f3:67:19:61)
Internet Protocol Version 4, Src: 192.168.116.170, Dst: 128.119.245.12
Transmission Control Protocol, Src Port: 52188, Dst Port: 80, Seq: 397, Ack: 11681, Len: 0

No.     Time           Source                Destination           Protocol Length Info
     60 7.051954       128.119.245.12        192.168.116.170       TCP      1514   80 → 52188 [ACK] Seq=11681 Ack=397 Win=30336 Len=1460 [TCP segment of a reassembled PDU]

Frame 60: 1514 bytes on wire (12112 bits), 1514 bytes captured (12112 bits) on interface 0
Ethernet II, Src: AsustekC_67:19:61 (00:18:f3:67:19:61), Dst: IntelCor_5c:42:bb (68:17:29:5c:42:bb)
Internet Protocol Version 4, Src: 128.119.245.12, Dst: 192.168.116.170
Transmission Control Protocol, Src Port: 80, Dst Port: 52188, Seq: 11681, Ack: 397, Len: 1460

No.     Time           Source                Destination           Protocol Length Info
     61 7.052981       128.119.245.12        192.168.116.170       TCP      1514   80 → 52188 [ACK] Seq=13141 Ack=397 Win=30336 Len=1460 [TCP segment of a reassembled PDU]

Frame 61: 1514 bytes on wire (12112 bits), 1514 bytes captured (12112 bits) on interface 0
Ethernet II, Src: AsustekC_67:19:61 (00:18:f3:67:19:61), Dst: IntelCor_5c:42:bb (68:17:29:5c:42:bb)
Internet Protocol Version 4, Src: 128.119.245.12, Dst: 192.168.116.170
Transmission Control Protocol, Src Port: 80, Dst Port: 52188, Seq: 13141, Ack: 397, Len: 1460

No.     Time           Source                Destination           Protocol Length Info
     62 7.053014       192.168.116.170       128.119.245.12        TCP      54     52188 → 80 [ACK] Seq=397 Ack=14601 Win=65536 Len=0

Frame 62: 54 bytes on wire (432 bits), 54 bytes captured (432 bits) on interface 0
Ethernet II, Src: IntelCor_5c:42:bb (68:17:29:5c:42:bb), Dst: AsustekC_67:19:61 (00:18:f3:67:19:61)
Internet Protocol Version 4, Src: 192.168.116.170, Dst: 128.119.245.12
Transmission Control Protocol, Src Port: 52188, Dst Port: 80, Seq: 397, Ack: 14601, Len: 0

No.     Time           Source                Destination           Protocol Length Info
     63 7.077714       192.168.116.170       128.119.245.12        TCP      54     52189 → 80 [ACK] Seq=383 Ack=3613 Win=64768 Len=0

Frame 63: 54 bytes on wire (432 bits), 54 bytes captured (432 bits) on interface 0
Ethernet II, Src: IntelCor_5c:42:bb (68:17:29:5c:42:bb), Dst: AsustekC_67:19:61 (00:18:f3:67:19:61)
Internet Protocol Version 4, Src: 192.168.116.170, Dst: 128.119.245.12
Transmission Control Protocol, Src Port: 52189, Dst Port: 80, Seq: 383, Ack: 3613, Len: 0

No.     Time           Source                Destination           Protocol Length Info
     64 7.359132       AsustekC_67:19:61     Broadcast             ARP      60     Who has 192.168.152.81? Tell 192.168.1.1

Frame 64: 60 bytes on wire (480 bits), 60 bytes captured (480 bits) on interface 0
Ethernet II, Src: AsustekC_67:19:61 (00:18:f3:67:19:61), Dst: Broadcast (ff:ff:ff:ff:ff:ff)
Address Resolution Protocol (request)

No.     Time           Source                Destination           Protocol Length Info
     65 7.528963       128.119.245.12        192.168.116.170       TCP      1514   80 → 52188 [ACK] Seq=14601 Ack=397 Win=30336 Len=1460 [TCP segment of a reassembled PDU]

Frame 65: 1514 bytes on wire (12112 bits), 1514 bytes captured (12112 bits) on interface 0
Ethernet II, Src: AsustekC_67:19:61 (00:18:f3:67:19:61), Dst: IntelCor_5c:42:bb (68:17:29:5c:42:bb)
Internet Protocol Version 4, Src: 128.119.245.12, Dst: 192.168.116.170
Transmission Control Protocol, Src Port: 80, Dst Port: 52188, Seq: 14601, Ack: 397, Len: 1460

No.     Time           Source                Destination           Protocol Length Info
     66 7.530362       128.119.245.12        192.168.116.170       TCP      1514   80 → 52188 [ACK] Seq=16061 Ack=397 Win=30336 Len=1460 [TCP segment of a reassembled PDU]

Frame 66: 1514 bytes on wire (12112 bits), 1514 bytes captured (12112 bits) on interface 0
Ethernet II, Src: AsustekC_67:19:61 (00:18:f3:67:19:61), Dst: IntelCor_5c:42:bb (68:17:29:5c:42:bb)
Internet Protocol Version 4, Src: 128.119.245.12, Dst: 192.168.116.170
Transmission Control Protocol, Src Port: 80, Dst Port: 52188, Seq: 16061, Ack: 397, Len: 1460

No.     Time           Source                Destination           Protocol Length Info
     67 7.530395       192.168.116.170       128.119.245.12        TCP      54     52188 → 80 [ACK] Seq=397 Ack=17521 Win=65536 Len=0

Frame 67: 54 bytes on wire (432 bits), 54 bytes captured (432 bits) on interface 0
Ethernet II, Src: IntelCor_5c:42:bb (68:17:29:5c:42:bb), Dst: AsustekC_67:19:61 (00:18:f3:67:19:61)
Internet Protocol Version 4, Src: 192.168.116.170, Dst: 128.119.245.12
Transmission Control Protocol, Src Port: 52188, Dst Port: 80, Seq: 397, Ack: 17521, Len: 0

No.     Time           Source                Destination           Protocol Length Info
     68 7.531898       128.119.245.12        192.168.116.170       TCP      1514   80 → 52188 [ACK] Seq=17521 Ack=397 Win=30336 Len=1460 [TCP segment of a reassembled PDU]

Frame 68: 1514 bytes on wire (12112 bits), 1514 bytes captured (12112 bits) on interface 0
Ethernet II, Src: AsustekC_67:19:61 (00:18:f3:67:19:61), Dst: IntelCor_5c:42:bb (68:17:29:5c:42:bb)
Internet Protocol Version 4, Src: 128.119.245.12, Dst: 192.168.116.170
Transmission Control Protocol, Src Port: 80, Dst Port: 52188, Seq: 17521, Ack: 397, Len: 1460

No.     Time           Source                Destination           Protocol Length Info
     69 7.533499       128.119.245.12        192.168.116.170       TCP      1514   80 → 52188 [ACK] Seq=18981 Ack=397 Win=30336 Len=1460 [TCP segment of a reassembled PDU]

Frame 69: 1514 bytes on wire (12112 bits), 1514 bytes captured (12112 bits) on interface 0
Ethernet II, Src: AsustekC_67:19:61 (00:18:f3:67:19:61), Dst: IntelCor_5c:42:bb (68:17:29:5c:42:bb)
Internet Protocol Version 4, Src: 128.119.245.12, Dst: 192.168.116.170
Transmission Control Protocol, Src Port: 80, Dst Port: 52188, Seq: 18981, Ack: 397, Len: 1460

No.     Time           Source                Destination           Protocol Length Info
     70 7.533533       192.168.116.170       128.119.245.12        TCP      54     52188 → 80 [ACK] Seq=397 Ack=20441 Win=65536 Len=0

Frame 70: 54 bytes on wire (432 bits), 54 bytes captured (432 bits) on interface 0
Ethernet II, Src: IntelCor_5c:42:bb (68:17:29:5c:42:bb), Dst: AsustekC_67:19:61 (00:18:f3:67:19:61)
Internet Protocol Version 4, Src: 192.168.116.170, Dst: 128.119.245.12
Transmission Control Protocol, Src Port: 52188, Dst Port: 80, Seq: 397, Ack: 20441, Len: 0

No.     Time           Source                Destination           Protocol Length Info
     71 7.537972       128.119.245.12        192.168.116.170       TCP      1514   80 → 52188 [ACK] Seq=20441 Ack=397 Win=30336 Len=1460 [TCP segment of a reassembled PDU]

